### ISSUE TITLE
Alexa UDP searches received but not by Fauxmo

### ISSUE THREAD

**Issue by alasdairsmith** [n8henrie/fauxmo#63]
- **Operating system and version**: Debian Stretch (9.4)
- **Python version**: 3.6.5 (in venv)
- **Fauxmo version**: 0.4.7
- **Echo device type**: Echo and Echo Dot
- **[Echo Firmware Version](https://github.com/n8henrie/fauxmo/blob/dev/README.md#troubleshooting--faq)**: 611498620

## My Issue
I can get fauxmo running and it says it is listening on 172.16.0.1 which is my server's local IP address. However Alexa doesn't detect the devices and there is nothing being logged by fauxmo to indicate that it is receiving the searches.

## [WHYT](http://mattgemmell.com/what-have-you-tried)

I have tried a tcpdump on the server when Alexa is searching for devices and that shows the server is receiving the searches. Has a look through the closed issues but couldn't see anything that applies. Using more recent version of Fauxmo and Alexa firmware than most of them.

---

Please make sure you've taken these steps before submitting a new issue:

- [x] Try to reproduce the issue with Fauxmo installed in a
  [venv](https://docs.python.org/3/library/venv.html)
- [x] Ensure you're running a supported version of Python
    - Requires Python >= 3.2 for Fauxmo < 0.3.0
    - Requires Python >= 3.4.4 for Fauxmo >= 0.3.0
    - Requires Python >= 3.6.0 for Fauxmo >= 0.4.0
- [x] Run Fauxmo in debug mode (`-vvv`) and include relevant output
- [x] Include your Fauxmo `config.json`
- [x] Search the existing (including closed) issues
- [x] Please use [codeblocks][1] around your debug output and config

[1]: https://help.github.com/articles/creating-and-highlighting-code-blocks/

# config.json
Using the default config for now but with the IP address set manually, as this is running on a router/firewall server and the global IP address was the one being auto-detected.
```
{
    "FAUXMO": {
        "ip_address": "172.16.0.1"
    },
    "PLUGINS": {
        "SimpleHTTPPlugin": {
            "DEVICES": [
                {
                    "port": 12340,
                    "on_cmd": "http://192.168.1.104/myserver/fakeswitches/01/on",
                    "off_cmd": "http://192.168.1.104/myserver/fakeswitches/01/off",
                    "method": "GET",
                    "name": "fake switch one"
                },
                {
                    "port": 12341,
                    "on_cmd": "http://localhost:54321/devices/garage%20light",
                    "off_cmd": "http://localhost:54321/devices/garage%20light",
                    "on_data": {"isOn": 1},
                    "off_data": {"isOn": 0},
                    "user": "this",
                    "password": "that",
                    "method": "PUT",
                    "name": "fake Indigo switch"
                },
                {
                    "name": "fake home assistant switch by REST API",
                    "port": 12342,
                    "on_cmd": "http://192.168.1.104:8123/api/services/switch/turn_on",
                    "off_cmd": "http://192.168.1.104:8123/api/services/switch/turn_off",
                    "method": "POST",
                    "headers": {"x-ha-access": "your_hass_password"},
                    "on_data": {"entity_id": "switch.fake_hass_switch"},
                    "off_data": {"entity_id": "switch.fake_hass_switch"}
                }
            ]
        }
    }
}
```

# fauxmo -vvv
Appears to be listening on 172.16.0.1 but never seems to receive anything.
```
# fauxmo -c config.json -vvv
2018-06-24 22:17:19 fauxmo:37       INFO     Fauxmo v0.4.7
2018-06-24 22:17:19 fauxmo:38       DEBUG    3.6.5 (default, Jun 24 2018, 19:53:14) 
[GCC 6.3.0 20170516]
2018-06-24 22:17:19 fauxmo:40       DEBUG    Using IP address: 172.16.0.1
2018-06-24 22:17:19 fauxmo:100      DEBUG    plugin_vars: {}
2018-06-24 22:17:19 fauxmo:103      DEBUG    device config: {'port': 12340, 'on_cmd': 'http://192.168.1.104/myserver/fakeswitches/01/on', 'off_cmd': 'http://192.168.1.104/myserver/fakeswitches/01/off', 'method': 'GET', 'name': 'fake switch one'}
2018-06-24 22:17:19 asyncio:1069     INFO     <Server sockets=[<socket.socket fd=7, family=AddressFamily.AF_INET, type=2049, proto=6, laddr=('172.16.0.1', 12340)>]> is serving
2018-06-24 22:17:19 fauxmo:121      DEBUG    Started fauxmo device: {'name': 'fake switch one', 'plugin': <fauxmo.plugins.simplehttpplugin.SimpleHTTPPlugin object at 0x7f0d8c72ed30>}
2018-06-24 22:17:19 fauxmo:103      DEBUG    device config: {'port': 12341, 'on_cmd': 'http://localhost:54321/devices/garage%20light', 'off_cmd': 'http://localhost:54321/devices/garage%20light', 'on_data': {'isOn': 1}, 'off_data': {'isOn': 0}, 'user': 'this', 'password': 'that', 'method': 'PUT', 'name': 'fake Indigo switch'}
2018-06-24 22:17:19 asyncio:1069     INFO     <Server sockets=[<socket.socket fd=8, family=AddressFamily.AF_INET, type=2049, proto=6, laddr=('172.16.0.1', 12341)>]> is serving
2018-06-24 22:17:19 fauxmo:121      DEBUG    Started fauxmo device: {'name': 'fake Indigo switch', 'plugin': <fauxmo.plugins.simplehttpplugin.SimpleHTTPPlugin object at 0x7f0d8c6cada0>}
2018-06-24 22:17:19 fauxmo:103      DEBUG    device config: {'name': 'fake home assistant switch by REST API', 'port': 12342, 'on_cmd': 'http://192.168.1.104:8123/api/services/switch/turn_on', 'off_cmd': 'http://192.168.1.104:8123/api/services/switch/turn_off', 'method': 'POST', 'headers': {'x-ha-access': 'your_hass_password'}, 'on_data': {'entity_id': 'switch.fake_hass_switch'}, 'off_data': {'entity_id': 'switch.fake_hass_switch'}}
2018-06-24 22:17:19 asyncio:1069     INFO     <Server sockets=[<socket.socket fd=9, family=AddressFamily.AF_INET, type=2049, proto=6, laddr=('172.16.0.1', 12342)>]> is serving
2018-06-24 22:17:19 fauxmo:121      DEBUG    Started fauxmo device: {'name': 'fake home assistant switch by REST API', 'plugin': <fauxmo.plugins.simplehttpplugin.SimpleHTTPPlugin object at 0x7f0d8c624668>}
2018-06-24 22:17:19 fauxmo:123      INFO     Starting UDP server
2018-06-24 22:17:19 asyncio:949      DEBUG    Datagram endpoint remote_addr=None created: (<_SelectorDatagramTransport fd=10 read=idle write=<idle, bufsize=0>>, <fauxmo.protocols.SSDPServer object at 0x7f0d8d2f5f98>)
^C2018-06-24 22:21:15 asyncio:1386     INFO     poll took 236133.066 ms: 1 events
2018-06-24 22:21:15 fauxmo:143      DEBUG    Shutdown starting...
2018-06-24 22:21:15 fauxmo:146      DEBUG    Shutting down server 0...
2018-06-24 22:21:15 fauxmo:146      DEBUG    Shutting down server 1...
2018-06-24 22:21:15 fauxmo:146      DEBUG    Shutting down server 2...
2018-06-24 22:21:15 asyncio:491      DEBUG    Close <_UnixSelectorEventLoop running=False closed=False debug=True>
```
# tcpdump
Running tcpdump instead of Fauxmo shows that the Alexa searches are being received by the server. The local interface is called lan and has IP address 172.16.0.1. Don't think it is a firewall problem.
```
# tcpdump -i lan -n udp dst port 1900 -A
tcpdump: verbose output suppressed, use -v or -vv for full protocol decode
listening on lan, link-type EN10MB (Ethernet), capture size 262144 bytes
22:12:46.518525 IP 172.16.0.141.50000 > 239.255.255.250.1900: UDP, length 94
E..zH.@..............P.l.f..M-SEARCH * HTTP/1.1
Host: 239.255.255.250:1900
Man: "ssdp:discover"
MX: 3
ST: ssdp:all


22:12:46.518970 IP 172.16.0.141.50000 > 239.255.255.250.1900: UDP, length 101
E...H.@..............P.l.m:{M-SEARCH * HTTP/1.1
Host: 239.255.255.250:1900
Man: "ssdp:discover"
MX: 3
ST: upnp:rootdevice


22:12:46.519033 IP 172.16.0.141.50000 > 239.255.255.250.1900: UDP, length 94
E..zH.@..............P.l.f..M-SEARCH * HTTP/1.1
Host: 239.255.255.250:1900
Man: "ssdp:discover"
MX: 3
ST: ssdp:all


22:12:46.519096 IP 172.16.0.141.50000 > 239.255.255.250.1900: UDP, length 101
E...H.@..............P.l.m:{M-SEARCH * HTTP/1.1
Host: 239.255.255.250:1900
Man: "ssdp:discover"
MX: 3
ST: upnp:rootdevice


22:12:46.519162 IP 172.16.0.141.50000 > 239.255.255.250.1900: UDP, length 94
E..zH.@..............P.l.f..M-SEARCH * HTTP/1.1
Host: 239.255.255.250:1900
Man: "ssdp:discover"
MX: 3
ST: ssdp:all


22:12:46.519238 IP 172.16.0.141.50000 > 239.255.255.250.1900: UDP, length 101
E...H.@..............P.l.m:{M-SEARCH * HTTP/1.1
Host: 239.255.255.250:1900
Man: "ssdp:discover"
MX: 3
ST: upnp:rootdevice


22:12:46.580788 IP 172.16.0.223.50000 > 239.255.255.250.1900: UDP, length 122
E.....@...HW.........P.l..w0M-SEARCH * HTTP/1.1
HOST: 239.255.255.250:1900
MAN: "ssdp:discover"
MX: 15
ST: urn:schemas-upnp-org:device:basic:1


22:12:46.702524 IP 172.16.0.223.50000 > 239.255.255.250.1900: UDP, length 122
E.....@...HR.........P.l..w0M-SEARCH * HTTP/1.1
HOST: 239.255.255.250:1900
MAN: "ssdp:discover"
MX: 15
ST: urn:schemas-upnp-org:device:basic:1


22:12:46.782805 IP 172.16.0.223.50000 > 239.255.255.250.1900: UDP, length 107
E....!@...H[.........P.l.s(.M-SEARCH * HTTP/1.1
HOST: 239.255.255.250:1900
MAN: "ssdp:discover"
MX: 15
ST: urn:Belkin:device:**


22:12:46.884760 IP 172.16.0.223.50000 > 239.255.255.250.1900: UDP, length 107
E....%@...HW.........P.l.s(.M-SEARCH * HTTP/1.1
HOST: 239.255.255.250:1900
MAN: "ssdp:discover"
MX: 15
ST: urn:Belkin:device:**
```

**Comment by n8henrie** [comment]
Thanks for the full bug report.

Very strange. Fauxmo should at least be logging *something* if that network data is reaching it.

Do you have anything else listening on 1900?

**Comment by alasdairsmith** [comment]
Hi

Thanks for having a look.

Just Python listening on 1900 when Fauxmo is running.

I've just tried creating a simple Python script which sends a message over UDP, to see if Fauxmo and also a simple listening script can receive it. Both receive the message when it is sent to 172.16.0.1 or 255.255.255.255 but not when it is broadcasted to 239.255.255.250, as the Alexa discovery packets would be.
```
2018-06-25 01:19:01 fauxmo:341      DEBUG    Received data below from ('172.16.0.10', 34377):
2018-06-25 01:19:01 fauxmo:342      DEBUG    Hello, World!
2018-06-25 01:25:49 asyncio:1386     INFO     poll took 407986.756 ms: 1 events
2018-06-25 01:25:49 fauxmo:341      DEBUG    Received data below from ('172.16.0.10', 43786):
2018-06-25 01:25:49 fauxmo:342      DEBUG    Hello, World!
```
So I think this is actually a network problem.

**Comment by alasdairsmith** [comment]
Adding a default route for all multicast traffic through my lan interface (literally called lan), seems to have fixed this:
```
# route add -net 224.0.0.0 netmask 240.0.0.0 lan
# ip route show
default dev bt scope link 
172.16.0.0/24 dev lan proto kernel scope link src 172.16.0.1 
172.16.19.19 dev bt proto kernel scope link src 86.144.219.38 
224.0.0.0/4 dev lan scope link
```
I think it may have been trying to reply using my bt (internet) interface instead. Perhaps the mismatch between the receiving network and the network to be used for replies was causing the packets to be ignored.

Alexa was able to discover the devices straightaway after I added this.
