### ISSUE TITLE
Works on one Echo, not the other

### ISSUE THREAD

**Issue by Nickduino** [n8henrie/fauxmo#72]
## My Issue
I found out the solution myself but I believe that's instructive as to how rational you should be before digging deep into packet sniffing (something I had never thought I would do). I'll post the solution in the comment after this post.

## [WHYT]
I do see traffic with my Echo spot:

![image](https://user-images.githubusercontent.com/9784237/52209536-8db8bf80-2884-11e9-8dab-9cd2c875e034.png)

The Echo 2 sends research requests but gets no answer:

![image](https://user-images.githubusercontent.com/9784237/52209682-f1db8380-2884-11e9-9b04-e13e98f26bb4.png)

From the Raspberry Pi point of view:

`pi@raspberrypi:~/Pi-Somfy $ sudo tshark -f "host 192.168.0.21" -Y "udp"
Running as user "root" and group "root". This could be dangerous.
tshark: Lua: Error during loading:
 /usr/share/wireshark/init.lua:32: dofile has been disabled due to running Wireshark as superuser. See https://wiki.wireshark.org/CaptureSetup/CapturePrivileges for help in running Wireshark as an unprivileged user.
Capturing on 'eth0'
    1 0.000000000 192.168.0.21 → 192.168.0.1  SSDP 429 HTTP/1.1 200 OK
    5 0.505926219 192.168.0.21 → 192.168.0.1  SSDP 429 HTTP/1.1 200 OK
   11 2.009656951 192.168.0.21 → 192.168.0.1  UDP 429 60567 → 1901 Len=387
   12 2.025395865  192.168.0.1 → 192.168.0.21 ICMP 70 Destination unreachable (Port unreachable)
   13 2.514341177 192.168.0.21 → 192.168.0.1  UDP 429 38157 → 1901 Len=387
   14 2.530370088  192.168.0.1 → 192.168.0.21 ICMP 70 Destination unreachable (Port unreachable)
   21 3.019551399 192.168.0.21 → 192.168.0.1  UDP 429 60348 → 1901 Len=387
   22 3.035479311  192.168.0.1 → 192.168.0.21 ICMP 70 Destination unreachable (Port unreachable)
   29 3.525324618 192.168.0.21 → 192.168.0.1  UDP 429 60785 → 1901 Len=387
   30 3.541112531  192.168.0.1 → 192.168.0.21 ICMP 70 Destination unreachable (Port unreachable)
   43 5.428204156 192.168.0.21 → 192.168.0.2  SSDP 429 HTTP/1.1 200 OK
   44 5.933116380 192.168.0.21 → 192.168.0.2  SSDP 429 HTTP/1.1 200 OK
   51 6.437629606 192.168.0.21 → 192.168.0.2  SSDP 429 HTTP/1.1 200 OK
   55 6.942699829 192.168.0.21 → 192.168.0.2  SSDP 429 HTTP/1.1 200 OK
   65 28.469132467 192.168.0.21 → 192.168.0.1  SSDP 429 HTTP/1.1 200 OK
   66 28.973862691 192.168.0.21 → 192.168.0.1  SSDP 429 HTTP/1.1 200 OK
   70 29.478261918 192.168.0.21 → 192.168.0.1  SSDP 429 HTTP/1.1 200 OK
   74 29.982864143 192.168.0.21 → 192.168.0.1  SSDP 429 HTTP/1.1 200 OK
   81 32.011022990 192.168.0.21 → 192.168.0.1  UDP 429 39117 → 1901 Len=387
   82 32.027042902  192.168.0.1 → 192.168.0.21 ICMP 70 Destination unreachable (Port unreachable)
   83 32.517140207 192.168.0.21 → 192.168.0.1  UDP 429 49885 → 1901 Len=387
   84 32.533037120  192.168.0.1 → 192.168.0.21 ICMP 70 Destination unreachable (Port unreachable)
   91 33.021233435 192.168.0.21 → 192.168.0.1  UDP 429 57976 → 1901 Len=387
   92 33.037095348  192.168.0.1 → 192.168.0.21 ICMP 70 Destination unreachable (Port unreachable)
  101 33.525944660 192.168.0.21 → 192.168.0.1  UDP 429 52271 → 1901 Len=387
  102 33.542019571  192.168.0.1 → 192.168.0.21 ICMP 70 Destination unreachable (Port unreachable)
  121 39.974472199 192.168.0.21 → 192.168.0.20 SSDP 429 HTTP/1.1 200 OK
  122 40.478951424 192.168.0.21 → 192.168.0.20 SSDP 429 HTTP/1.1 200 OK
  126 40.983589649 192.168.0.21 → 192.168.0.20 SSDP 429 HTTP/1.1 200 OK
  130 41.488576872 192.168.0.21 → 192.168.0.20 SSDP 429 HTTP/1.1 200 OK
  134 42.006594023 192.168.0.21 → 192.168.0.20 SSDP 429 HTTP/1.1 200 OK
  138 42.511608246 192.168.0.21 → 192.168.0.20 SSDP 429 HTTP/1.1 200 OK
  142 43.016699469 192.168.0.21 → 192.168.0.20 SSDP 429 HTTP/1.1 200 OK
  146 43.521941690 192.168.0.21 → 192.168.0.20 SSDP 429 HTTP/1.1 200 OK
  155 52.818193566 192.168.0.21 → 192.168.0.2  SSDP 429 HTTP/1.1 200 OK
  159 53.323230788 192.168.0.21 → 192.168.0.2  SSDP 429 HTTP/1.1 200 OK
  168 53.827609014 192.168.0.21 → 192.168.0.2  SSDP 429 HTTP/1.1 200 OK
  172 54.332600237 192.168.0.21 → 192.168.0.2  SSDP 429 HTTP/1.1 200 OK
  181 56.954549817 192.168.0.21 → 192.168.0.1  SSDP 429 HTTP/1.1 200 OK
  185 57.459357041 192.168.0.21 → 192.168.0.1  SSDP 429 HTTP/1.1 200 OK
  193 57.965072260 192.168.0.21 → 192.168.0.1  SSDP 429 HTTP/1.1 200 OK
  194 58.469867483 192.168.0.21 → 192.168.0.1  SSDP 429 HTTP/1.1 200 OK
  201 62.012705998 192.168.0.21 → 192.168.0.1  UDP 429 53129 → 1901 Len=387
  202 62.028595911  192.168.0.1 → 192.168.0.21 ICMP 70 Destination unreachable (Port unreachable)
  203 62.518722215 192.168.0.21 → 192.168.0.1  UDP 429 50158 → 1901 Len=387
  204 62.534530128  192.168.0.1 → 192.168.0.21 ICMP 70 Destination unreachable (Port unreachable)
  211 63.023592439 192.168.0.21 → 192.168.0.1  UDP 429 38428 → 1901 Len=387
  212 63.039694350  192.168.0.1 → 192.168.0.21 ICMP 70 Destination unreachable (Port unreachable)
  219 63.528194663 192.168.0.21 → 192.168.0.1  UDP 429 40765 → 1901 Len=387
  220 63.544006576  192.168.0.1 → 192.168.0.21 ICMP 70 Destination unreachable (Port unreachable)`

The RAW tcpdump shows this:
```
pi@raspberrypi:~ $ sudo tcpdump -s 0 -i eth0 -A host 192.168.0.37
tcpdump: verbose output suppressed, use -v or -vv for full protocol decode
listening on eth0, link-type EN10MB (Ethernet), capture size 262144 bytes
13:59:32.377768 ARP, Request who-has 192.168.0.37 tell 133.45.15.93.rev.sfr.net, length 46
..............].-..........%..................
13:59:38.387969 ARP, Request who-has 192.168.0.37 tell 133.45.15.93.rev.sfr.net, length 46
..............].-..........%..................
13:59:41.803291 ARP, Request who-has 192.168.0.37 tell 133.45.15.93.rev.sfr.net, length 46
..............].-..........%..................
13:59:58.986898 IP 192.168.0.37.50000 > 239.255.255.250.1900: UDP, length 94
E..zW.@...q....%.....P.l.f..M-SEARCH * HTTP/1.1
Host: 239.255.255.250:1900
Man: "ssdp:discover"
MX: 3
ST: ssdp:all


13:59:58.991637 ARP, Request who-has 192.168.0.37 tell 192.168.0.2, length 46
............lb.............%..................
13:59:58.994196 IP 192.168.0.37.50000 > 239.255.255.250.1900: UDP, length 101
E...W.@...q....%.....P.l.m&KM-SEARCH * HTTP/1.1
Host: 239.255.255.250:1900
Man: "ssdp:discover"
MX: 3
ST: upnp:rootdevice


13:59:59.001674 IP 192.168.0.37.50000 > 239.255.255.250.1900: UDP, length 94
E..zW.@...q....%.....P.l.f..M-SEARCH * HTTP/1.1
Host: 239.255.255.250:1900
Man: "ssdp:discover"
MX: 3
ST: ssdp:all


13:59:59.009728 IP 192.168.0.37.50000 > 239.255.255.250.1900: UDP, length 101
E...W.@...q....%.....P.l.m&KM-SEARCH * HTTP/1.1
Host: 239.255.255.250:1900
Man: "ssdp:discover"
MX: 3
ST: upnp:rootdevice


13:59:59.017609 IP 192.168.0.37.50000 > 239.255.255.250.1900: UDP, length 94
E..zW.@...q....%.....P.l.f..M-SEARCH * HTTP/1.1
Host: 239.255.255.250:1900
Man: "ssdp:discover"
MX: 3
ST: ssdp:all


13:59:59.025626 IP 192.168.0.37.50000 > 239.255.255.250.1900: UDP, length 101
E...W.@...q....%.....P.l.m&KM-SEARCH * HTTP/1.1
Host: 239.255.255.250:1900
Man: "ssdp:discover"
MX: 3
ST: upnp:rootdevice


13:59:59.503176 ARP, Request who-has 192.168.0.37 tell 192.168.0.21, length 28
.........'.................%
13:59:59.991665 ARP, Request who-has 192.168.0.37 tell 192.168.0.2, length 46
............lb.............%..................
14:00:00.570069 ARP, Request who-has 192.168.0.37 tell 192.168.0.21, length 28
.........'.................%
14:00:00.991646 ARP, Request who-has 192.168.0.37 tell 192.168.0.2, length 46
............lb.............%..................
14:00:01.610043 ARP, Request who-has 192.168.0.37 tell 192.168.0.21, length 28
.........'.................%
14:00:02.047661 ARP, Request who-has 192.168.0.37 tell 192.168.0.2, length 46
............lb.............%..................
14:00:03.047658 ARP, Request who-has 192.168.0.37 tell 192.168.0.2, length 46
............lb.............%..................
14:00:03.063151 ARP, Request who-has 192.168.0.37 tell 192.168.0.21, length 28
.........'.................%
14:00:04.047649 ARP, Request who-has 192.168.0.37 tell 192.168.0.2, length 46
............lb.............%..................
14:00:04.090044 ARP, Request who-has 192.168.0.37 tell 192.168.0.21, length 28
.........'.................%
14:00:05.130092 ARP, Request who-has 192.168.0.37 tell 192.168.0.21, length 28
.........'.................%
```

There's also on the Echo spot:
`pi@raspberrypi:~ $ sudo tshark -f "src 192.168.0.21 and dst 192.168.0.29" -c 1 -V
Running as user "root" and group "root". This could be dangerous.
tshark: Lua: Error during loading:
 /usr/share/wireshark/init.lua:32: dofile has been disabled due to running Wireshark as superuser. See https://wiki.wireshark.org/CaptureSetup/CapturePrivileges for help in running Wireshark as an unprivileged user.
Capturing on 'eth0'
Frame 1: 429 bytes on wire (3432 bits), 429 bytes captured (3432 bits) on interface 0
    Interface id: 0 (eth0)
        Interface name: eth0
    Encapsulation type: Ethernet (1)
    Arrival Time: Feb  4, 2019 14:07:27.715197494 CET
    [Time shift for this packet: 0.000000000 seconds]
    Epoch Time: 1549285647.715197494 seconds
    [Time delta from previous captured frame: 0.000000000 seconds]
    [Time delta from previous displayed frame: 0.000000000 seconds]
    [Time since reference or first frame: 0.000000000 seconds]
    Frame Number: 1
    Frame Length: 429 bytes (3432 bits)
    Capture Length: 429 bytes (3432 bits)
    [Frame is marked: False]
    [Frame is ignored: False]
    [Protocols in frame: eth:ethertype:ip:udp:data]
Ethernet II, Src: Raspberr_f1:96:bd (b8:27:eb:f1:96:bd), Dst: AmazonTe_aa:8a:4d (24:4c:e3:aa:8a:4d)
    Destination: AmazonTe_aa:8a:4d (24:4c:e3:aa:8a:4d)
        Address: AmazonTe_aa:8a:4d (24:4c:e3:aa:8a:4d)
        .... ..0. .... .... .... .... = LG bit: Globally unique address (factory default)
        .... ...0 .... .... .... .... = IG bit: Individual address (unicast)
    Source: Raspberr_f1:96:bd (b8:27:eb:f1:96:bd)
        Address: Raspberr_f1:96:bd (b8:27:eb:f1:96:bd)
        .... ..0. .... .... .... .... = LG bit: Globally unique address (factory default)
        .... ...0 .... .... .... .... = IG bit: Individual address (unicast)
    Type: IPv4 (0x0800)
Internet Protocol Version 4, Src: 192.168.0.21, Dst: 192.168.0.29
    0100 .... = Version: 4
    .... 0101 = Header Length: 20 bytes (5)
    Differentiated Services Field: 0x00 (DSCP: CS0, ECN: Not-ECT)
        0000 00.. = Differentiated Services Codepoint: Default (0)
        .... ..00 = Explicit Congestion Notification: Not ECN-Capable Transport (0)
    Total Length: 415
    Identification: 0xac56 (44118)
    Flags: 0x4000, Don't fragment
        0... .... .... .... = Reserved bit: Not set
        .1.. .... .... .... = Don't fragment: Set
        ..0. .... .... .... = More fragments: Not set
        ...0 0000 0000 0000 = Fragment offset: 0
    Time to live: 64
    Protocol: UDP (17)
    Header checksum: 0x0b75 [validation disabled]
    [Header checksum status: Unverified]
    Source: 192.168.0.21
    Destination: 192.168.0.29
User Datagram Protocol, Src Port: 53140, Dst Port: 50000
    Source Port: 53140
    Destination Port: 50000
    Length: 395
    Checksum: 0x831f [unverified]
    [Checksum Status: Unverified]
    [Stream index: 0]
Data (387 bytes)

0000  48 54 54 50 2f 31 2e 31 20 32 30 30 20 4f 4b 0d   HTTP/1.1 200 OK.
0010  0a 43 41 43 48 45 2d 43 4f 4e 54 52 4f 4c 3a 20   .CACHE-CONTROL:
0020  6d 61 78 2d 61 67 65 3d 38 36 34 30 30 0d 0a 44   max-age=86400..D
0030  41 54 45 3a 20 4d 6f 6e 2c 20 30 34 20 46 65 62   ATE: Mon, 04 Feb
0040  20 32 30 31 39 20 31 33 3a 30 37 3a 32 37 20 47    2019 13:07:27 G
0050  4d 54 0d 0a 45 58 54 3a 0d 0a 4c 4f 43 41 54 49   MT..EXT:..LOCATI
0060  4f 4e 3a 20 68 74 74 70 3a 2f 2f 31 39 32 2e 31   ON: http://192.1
0070  36 38 2e 30 2e 32 31 3a 35 32 38 39 38 2f 73 65   68.0.21:52898/se
0080  74 75 70 2e 78 6d 6c 0d 0a 4f 50 54 3a 20 22 68   tup.xml..OPT: "h
0090  74 74 70 3a 2f 2f 73 63 68 65 6d 61 73 2e 75 70   ttp://schemas.up
00a0  6e 70 2e 6f 72 67 2f 75 70 6e 70 2f 31 2f 30 2f   np.org/upnp/1/0/
00b0  22 3b 20 6e 73 3d 30 31 0d 0a 30 31 2d 4e 4c 53   "; ns=01..01-NLS
00c0  3a 20 37 33 66 31 65 30 61 36 2d 38 63 30 66 2d   : 73f1e0a6-8c0f-
00d0  34 30 36 30 2d 62 37 33 36 2d 36 38 62 30 31 61   4060-b736-68b01a
00e0  61 66 36 30 37 64 0d 0a 53 45 52 56 45 52 3a 20   af607d..SERVER:
00f0  55 6e 73 70 65 63 69 66 69 65 64 2c 20 55 50 6e   Unspecified, UPn
0100  50 2f 31 2e 30 2c 20 55 6e 73 70 65 63 69 66 69   P/1.0, Unspecifi
0110  65 64 0d 0a 53 54 3a 20 75 72 6e 3a 42 65 6c 6b   ed..ST: urn:Belk
0120  69 6e 3a 64 65 76 69 63 65 3a 2a 2a 0d 0a 55 53   in:device:**..US
0130  4e 3a 20 75 75 69 64 3a 53 6f 63 6b 65 74 2d 31   N: uuid:Socket-1
0140  5f 30 2d 34 39 61 35 36 36 66 36 63 36 35 37 34   _0-49a566f6c6574
0150  37 3a 3a 75 72 6e 3a 42 65 6c 6b 69 6e 3a 64 65   7::urn:Belkin:de
0160  76 69 63 65 3a 2a 2a 0d 0a 58 2d 55 73 65 72 2d   vice:**..X-User-
0170  41 67 65 6e 74 3a 20 72 65 64 73 6f 6e 69 63 0d   Agent: redsonic.
0180  0a 0d 0a                                          ...
    Data: 485454502f312e3120323030204f4b0d0a43414348452d43...
    [Length: 387]

1 packet captured`

Not on the Echo 2:
```
pi@raspberrypi:~ $ sudo tshark -f "src 192.168.0.21 and dst 192.168.0.37" -c 1 -V
Running as user "root" and group "root". This could be dangerous.
tshark: Lua: Error during loading:
 /usr/share/wireshark/init.lua:32: dofile has been disabled due to running Wireshark as superuser. See https://wiki.wireshark.org/CaptureSetup/CapturePrivileges for help in running Wireshark as an unprivileged user.
Capturing on 'eth0'
Frame 1: 42 bytes on wire (336 bits), 42 bytes captured (336 bits) on interface 0
    Interface id: 0 (eth0)
        Interface name: eth0
    Encapsulation type: Ethernet (1)
    Arrival Time: Feb  4, 2019 14:04:28.881057538 CET
    [Time shift for this packet: 0.000000000 seconds]
    Epoch Time: 1549285468.881057538 seconds
    [Time delta from previous captured frame: 0.000000000 seconds]
    [Time delta from previous displayed frame: 0.000000000 seconds]
    [Time since reference or first frame: 0.000000000 seconds]
    Frame Number: 1
    Frame Length: 42 bytes (336 bits)
    Capture Length: 42 bytes (336 bits)
    [Frame is marked: False]
    [Frame is ignored: False]
    [Protocols in frame: eth:ethertype:arp]
Ethernet II, Src: Raspberr_f1:96:bd (b8:27:eb:f1:96:bd), Dst: Broadcast (ff:ff:ff:ff:ff:ff)
    Destination: Broadcast (ff:ff:ff:ff:ff:ff)
        Address: Broadcast (ff:ff:ff:ff:ff:ff)
        .... ..1. .... .... .... .... = LG bit: Locally administered address (this is NOT the factory default)
        .... ...1 .... .... .... .... = IG bit: Group address (multicast/broadcast)
    Source: Raspberr_f1:96:bd (b8:27:eb:f1:96:bd)
        Address: Raspberr_f1:96:bd (b8:27:eb:f1:96:bd)
        .... ..0. .... .... .... .... = LG bit: Globally unique address (factory default)
        .... ...0 .... .... .... .... = IG bit: Individual address (unicast)
    Type: ARP (0x0806)
Address Resolution Protocol (request)
    Hardware type: Ethernet (1)
    Protocol type: IPv4 (0x0800)
    Hardware size: 6
    Protocol size: 4
    Opcode: request (1)
    Sender MAC address: Raspberr_f1:96:bd (b8:27:eb:f1:96:bd)
    Sender IP address: 192.168.0.21
    Target MAC address: 00:00:00_00:00:00 (00:00:00:00:00:00)
    Target IP address: 192.168.0.37

1 packet captured
```

**Comment by n8henrie** [comment]
Glad you got it sorted out.

**Comment by Secarius** [comment]
Hi @Nickduino this is the communication between rpi 192.168.178.100 and amazone echo input 192.168.178.26:

```
pi@raspberrypi:~ $ sudo tshark -f "host 192.168.178.100 && host 192.168.178.26"
Running as user "root" and group "root". This could be dangerous.
Capturing on 'eth0'
    1 0.000000000 192.168.178.100 → 192.168.178.26 UDP 432 34195 → 50000 Len=390
    2 0.152717656 192.168.178.26 → 192.168.178.100 TCP 74 38034 → 54337 [SYN] Seq=0 Win=65535 Len=0 MSS=1460 SACK_PERM=1 TSval=132398458 TSecr=0 WS=64
    3 0.152944686 192.168.178.100 → 192.168.178.26 TCP 74 54337 → 38034 [SYN, ACK] Seq=0 Ack=1 Win=65160 Len=0 MSS=1460 SACK_PERM=1 TSval=1947233689 TSecr=132398458 WS=128
    4 0.161395242 192.168.178.26 → 192.168.178.100 TCP 66 38034 → 54337 [ACK] Seq=1 Ack=1 Win=87616 Len=0 TSval=132398476 TSecr=1947233689
    5 0.161399148 192.168.178.26 → 192.168.178.100 TCP 167 GET /setup.xml HTTP/1.1  [TCP segment of a reassembled PDU]
    6 0.161608679 192.168.178.100 → 192.168.178.26 TCP 66 54337 → 38034 [ACK] Seq=1 Ack=102 Win=65152 Len=0 TSval=1947233698 TSecr=132398476
    7 0.501970283 192.168.178.100 → 192.168.178.26 UDP 432 36251 → 50000 Len=390
    8 1.004008199 192.168.178.100 → 192.168.178.26 UDP 432 42732 → 50000 Len=390
    9 1.506131177 192.168.178.100 → 192.168.178.26 UDP 432 39794 → 50000 Len=390
   10 2.008165173 192.168.178.100 → 192.168.178.26 UDP 432 41933 → 50000 Len=390
   11 2.510358867 192.168.178.100 → 192.168.178.26 UDP 432 33391 → 50000 Len=390
   12 3.033413905 192.168.178.100 → 192.168.178.26 UDP 432 55122 → 50000 Len=390
   13 3.535483316 192.168.178.100 → 192.168.178.26 UDP 432 43689 → 50000 Len=390
   14 4.037502960 192.168.178.100 → 192.168.178.26 UDP 432 49102 → 50000 Len=390
   15 4.539582929 192.168.178.100 → 192.168.178.26 UDP 432 57019 → 50000 Len=390
   16 5.041770527 192.168.178.100 → 192.168.178.26 UDP 432 40688 → 50000 Len=390
   17 5.090199665 192.168.178.26 → 192.168.178.100 HTTP 66 GET /setup.xml HTTP/1.1
   18 5.139905623 192.168.178.100 → 192.168.178.26 TCP 66 54337 → 38034 [ACK] Seq=1 Ack=103 Win=65152 Len=0 TSval=1947238676 TSecr=132399708
   19 5.296050675 192.168.178.26 → 192.168.178.100 TCP 74 49744 → 54338 [SYN] Seq=0 Win=65535 Len=0 MSS=1460 SACK_PERM=1 TSval=132399759 TSecr=0 WS=64
   20 5.296206716 192.168.178.100 → 192.168.178.26 TCP 74 54338 → 49744 [SYN, ACK] Seq=0 Ack=1 Win=65160 Len=0 MSS=1460 SACK_PERM=1 TSval=1947238832 TSecr=132399759 WS=128
   21 5.302065092 192.168.178.26 → 192.168.178.100 TCP 66 49744 → 54338 [ACK] Seq=1 Ack=1 Win=87616 Len=0 TSval=132399761 TSecr=1947238832
   22 5.302629414 192.168.178.26 → 192.168.178.100 TCP 167 GET /setup.xml HTTP/1.1  [TCP segment of a reassembled PDU]
   23 5.302695507 192.168.178.100 → 192.168.178.26 TCP 66 54338 → 49744 [ACK] Seq=1 Ack=102 Win=65152 Len=0 TSval=1947238839 TSecr=132399761
   24 5.543875169 192.168.178.100 → 192.168.178.26 UDP 432 42979 → 50000 Len=390
   25 5.547482715 192.168.178.100 → 192.168.178.26 HTTP/XML 1419 HTTP/1.1 200 OK
   26 5.554715255 192.168.178.26 → 192.168.178.100 TCP 60 38034 → 54337 [RST] Seq=103 Win=0 Len=0
   27 6.070725159 192.168.178.100 → 192.168.178.26 UDP 432 48968 → 50000 Len=390
   28 6.572806766 192.168.178.100 → 192.168.178.26 UDP 432 52955 → 50000 Len=390
   29 7.074862560 192.168.178.100 → 192.168.178.26 UDP 432 36199 → 50000 Len=390
   30 7.577077380 192.168.178.100 → 192.168.178.26 UDP 432 48195 → 50000 Len=390
   31 8.079277845 192.168.178.100 → 192.168.178.26 UDP 432 38762 → 50000 Len=390
   32 8.581396449 192.168.178.100 → 192.168.178.26 UDP 432 51425 → 50000 Len=390
   33 8.584734414 192.168.178.100 → 192.168.178.26 HTTP/XML 1424 HTTP/1.1 200 OK
   34 8.637511059 192.168.178.26 → 192.168.178.100 TCP 66 49744 → 54338 [ACK] Seq=102 Ack=1359 Win=90368 Len=0 TSval=132400595 TSecr=1947242121
   35 8.637518142 192.168.178.26 → 192.168.178.100 HTTP 66 GET /setup.xml HTTP/1.1
   36 8.638092829 192.168.178.26 → 192.168.178.100 TCP 74 58508 → 54339 [SYN] Seq=0 Win=65535 Len=0 MSS=1460 SACK_PERM=1 TSval=132400595 TSecr=0 WS=64
   37 8.638327464 192.168.178.100 → 192.168.178.26 TCP 74 54339 → 58508 [SYN, ACK] Seq=0 Ack=1 Win=65160 Len=0 MSS=1460 SACK_PERM=1 TSval=1947242175 TSecr=132400595 WS=128
   38 8.638707984 192.168.178.100 → 192.168.178.26 TCP 66 54338 → 49744 [FIN, ACK] Seq=1359 Ack=103 Win=65152 Len=0 TSval=1947242175 TSecr=132400595
   39 8.641945011 192.168.178.26 → 192.168.178.100 TCP 66 58508 → 54339 [ACK] Seq=1 Ack=1 Win=87616 Len=0 TSval=132400596 TSecr=1947242175
   40 8.641948917 192.168.178.26 → 192.168.178.100 TCP 167 GET /setup.xml HTTP/1.1  [TCP segment of a reassembled PDU]
   41 8.642278604 192.168.178.100 → 192.168.178.26 TCP 66 54339 → 58508 [ACK] Seq=1 Ack=102 Win=65152 Len=0 TSval=1947242178 TSecr=132400596
   42 8.642388448 192.168.178.26 → 192.168.178.100 TCP 66 49744 → 54338 [ACK] Seq=103 Ack=1360 Win=90368 Len=0 TSval=132400596 TSecr=1947242175
   43 8.663945501 192.168.178.100 → 192.168.178.26 HTTP/XML 1420 HTTP/1.1 200 OK
   44 8.683442037 192.168.178.26 → 192.168.178.100 TCP 66 58508 → 54339 [ACK] Seq=102 Ack=1355 Win=90368 Len=0 TSval=132400606 TSecr=1947242200
   45 8.683646203 192.168.178.26 → 192.168.178.100 HTTP 66 GET /setup.xml HTTP/1.1
   46 8.684517452 192.168.178.100 → 192.168.178.26 TCP 66 54339 → 58508 [FIN, ACK] Seq=1355 Ack=103 Win=65152 Len=0 TSval=1947242221 TSecr=132400607
   47 8.685788856 192.168.178.26 → 192.168.178.100 TCP 66 58508 → 54339 [ACK] Seq=103 Ack=1356 Win=90368 Len=0 TSval=132400607 TSecr=1947242221
   48 8.687211563 192.168.178.26 → 192.168.178.100 TCP 74 38180 → 54340 [SYN] Seq=0 Win=65535 Len=0 MSS=1460 SACK_PERM=1 TSval=132400608 TSecr=0 WS=64
   49 8.687364010 192.168.178.100 → 192.168.178.26 TCP 74 54340 → 38180 [SYN, ACK] Seq=0 Ack=1 Win=65160 Len=0 MSS=1460 SACK_PERM=1 TSval=1947242224 TSecr=132400608 WS=128
   50 8.689289060 192.168.178.26 → 192.168.178.100 TCP 66 38180 → 54340 [ACK] Seq=1 Ack=1 Win=87616 Len=0 TSval=132400608 TSecr=1947242224
   51 8.689292393 192.168.178.26 → 192.168.178.100 TCP 167 GET /setup.xml HTTP/1.1  [TCP segment of a reassembled PDU]
   52 8.689454737 192.168.178.100 → 192.168.178.26 TCP 66 54340 → 38180 [ACK] Seq=1 Ack=102 Win=65152 Len=0 TSval=1947242226 TSecr=132400608
   53 8.708240023 192.168.178.100 → 192.168.178.26 HTTP/XML 1420 HTTP/1.1 200 OK
   54 8.755392770 192.168.178.26 → 192.168.178.100 TCP 66 38180 → 54340 [ACK] Seq=102 Ack=1355 Win=90368 Len=0 TSval=132400625 TSecr=1947242244
   55 8.757989329 192.168.178.26 → 192.168.178.100 HTTP 66 GET /setup.xml HTTP/1.1
   56 8.757992714 192.168.178.26 → 192.168.178.100 TCP 74 33496 → 54341 [SYN] Seq=0 Win=65535 Len=0 MSS=1460 SACK_PERM=1 TSval=132400625 TSecr=0 WS=64
   57 8.758165995 192.168.178.100 → 192.168.178.26 TCP 74 54341 → 33496 [SYN, ACK] Seq=0 Ack=1 Win=65160 Len=0 MSS=1460 SACK_PERM=1 TSval=1947242294 TSecr=132400625 WS=128
   58 8.758725995 192.168.178.100 → 192.168.178.26 TCP 66 54340 → 38180 [FIN, ACK] Seq=1355 Ack=103 Win=65152 Len=0 TSval=1947242295 TSecr=132400625
   59 8.761900417 192.168.178.26 → 192.168.178.100 TCP 66 33496 → 54341 [ACK] Seq=1 Ack=1 Win=87616 Len=0 TSval=132400626 TSecr=1947242294
   60 8.761904532 192.168.178.26 → 192.168.178.100 TCP 167 GET /setup.xml HTTP/1.1  [TCP segment of a reassembled PDU]
   61 8.762126667 192.168.178.100 → 192.168.178.26 TCP 66 54341 → 33496 [ACK] Seq=1 Ack=102 Win=65152 Len=0 TSval=1947242298 TSecr=132400626
   62 8.770149468 192.168.178.26 → 192.168.178.100 TCP 66 38180 → 54340 [ACK] Seq=103 Ack=1356 Win=90368 Len=0 TSval=132400627 TSecr=1947242295
   63 8.782244660 192.168.178.100 → 192.168.178.26 HTTP/XML 1426 HTTP/1.1 200 OK
   64 8.784224240 192.168.178.26 → 192.168.178.100 TCP 66 33496 → 54341 [ACK] Seq=102 Ack=1361 Win=90368 Len=0 TSval=132400632 TSecr=1947242318
   65 8.784232209 192.168.178.26 → 192.168.178.100 HTTP 66 GET /setup.xml HTTP/1.1
   66 8.785495384 192.168.178.26 → 192.168.178.100 TCP 74 49882 → 54342 [SYN] Seq=0 Win=65535 Len=0 MSS=1460 SACK_PERM=1 TSval=132400632 TSecr=0 WS=64
   67 8.785627624 192.168.178.100 → 192.168.178.26 TCP 74 54342 → 49882 [SYN, ACK] Seq=0 Ack=1 Win=65160 Len=0 MSS=1460 SACK_PERM=1 TSval=1947242322 TSecr=132400632 WS=128
   68 8.786956632 192.168.178.26 → 192.168.178.100 TCP 66 49882 → 54342 [ACK] Seq=1 Ack=1 Win=87616 Len=0 TSval=132400632 TSecr=1947242322
   69 8.786959705 192.168.178.26 → 192.168.178.100 TCP 167 GET /setup.xml HTTP/1.1  [TCP segment of a reassembled PDU]
   70 8.787114757 192.168.178.100 → 192.168.178.26 TCP 66 54342 → 49882 [ACK] Seq=1 Ack=102 Win=65152 Len=0 TSval=1947242323 TSecr=132400632
   71 8.793441363 192.168.178.100 → 192.168.178.26 TCP 66 54341 → 33496 [FIN, ACK] Seq=1361 Ack=103 Win=65152 Len=0 TSval=1947242330 TSecr=132400632
   72 8.794719955 192.168.178.26 → 192.168.178.100 TCP 66 33496 → 54341 [ACK] Seq=103 Ack=1362 Win=90368 Len=0 TSval=132400634 TSecr=1947242330
   73 8.806308897 192.168.178.100 → 192.168.178.26 HTTP/XML 1426 HTTP/1.1 200 OK
   74 8.810443162 192.168.178.26 → 192.168.178.100 TCP 66 49882 → 54342 [ACK] Seq=102 Ack=1361 Win=90368 Len=0 TSval=132400638 TSecr=1947242343
   75 8.810602277 192.168.178.26 → 192.168.178.100 HTTP 66 GET /setup.xml HTTP/1.1
   76 8.817203569 192.168.178.100 → 192.168.178.26 TCP 66 54342 → 49882 [FIN, ACK] Seq=1361 Ack=103 Win=65152 Len=0 TSval=1947242353 TSecr=132400638
   77 8.818473724 192.168.178.26 → 192.168.178.100 TCP 66 49882 → 54342 [ACK] Seq=103 Ack=1362 Win=90368 Len=0 TSval=132400640 TSecr=1947242353
```
I don't understand if i have the same problem as you.
Could you please have a look?

**Comment by Nickduino** [comment]
Sorry, I can't tell (I suck at many things in life, networking is one of them)
